{
  "timestamp": "2025-08-15T00:05:03.387612",
  "original_prompt": "Fix the 500 error in the API authentication endpoint that's causing login failures",
  "analysis": {
    "task_type": "debugging",
    "priority": "normal",
    "detected_keywords": [
      "fix",
      "error",
      "authentication",
      "auth",
      "failure",
      "log",
      "500",
      "ai"
    ],
    "complexity": "low"
  },
  "selected_agents": [
    {
      "key": "codebase-error-analyzer",
      "name": "Codebase Error Analyzer",
      "file": "codebase-error-analyzer.md",
      "score": 1.615,
      "reason": "Detected keywords: error, failure, log"
    },
    {
      "key": "senior-coder",
      "name": "Senior Code Agent",
      "file": "senior-coder.md",
      "score": 0.6,
      "reason": "Detected keywords: authentication, auth"
    },
    {
      "key": "coder",
      "name": "Code Agent",
      "file": "coder.md",
      "score": 0.54,
      "reason": "Detected keywords: fix, error"
    }
  ],
  "delegation_command": "python /Users/kianwoonwong/Downloads/jarvis/request_agent_work.py \\\n    --task \"Fix the 500 error in the API authentication endpoint that's causing login failures\" \\\n    --agents \"Codebase Error Analyzer,Senior Code Agent,Code Agent\" \\\n    --context \"Task Type: debugging Selected Agents: Codebase Error Analyzer, Senior Code Agent, Code Agent Timestamp: 2025-08-15T00:05:03.387593 Source: Claude Code Hook System Execution Mode: Delegated (Claude is READ-ONLY) Focus: Error analysis and resolution\" \\\n    --priority normal \\\n    --max-iterations 10",
  "reminder": "\n\ud83e\udd16 AGENT DELEGATION REQUIRED\n============================\nClaude Code operates in READ-ONLY mode. All execution must be delegated to agents.\n\n\ud83d\udccb Task Analysis:\n- Task Type: debugging\n- Recommended Agents: Codebase Error Analyzer, Senior Code Agent, Code Agent\n\n\ud83d\udd27 Selected Agents:\n\n\u2022 Codebase Error Analyzer (codebase-error-analyzer.md)\n  Reason: Detected keywords: error, failure, log\n  Relevance Score: 1.61\n\u2022 Senior Code Agent (senior-coder.md)\n  Reason: Detected keywords: authentication, auth\n  Relevance Score: 0.60\n\u2022 Code Agent (coder.md)\n  Reason: Detected keywords: fix, error\n  Relevance Score: 0.54\n\n\u26a0\ufe0f IMPORTANT REMINDERS:\n1. You (Claude) can ONLY read and analyze code\n2. ALL modifications must go through agents\n3. Use request_agent_work.py for delegation\n4. Never use Write, Edit, or Execute tools directly\n5. Agents handle all execution and modifications\n\n\ud83d\udccc Next Steps:\n1. Analyze the request using Read/Grep/Glob tools\n2. Create a plan for the agents\n3. Delegate work using the command above\n4. Monitor progress with BashOutput\n5. Verify results through reading\n\nRemember: You are the architect and analyzer. Agents are the builders.\n",
  "context": "Task Type: debugging\nSelected Agents: Codebase Error Analyzer, Senior Code Agent, Code Agent\nTimestamp: 2025-08-15T00:05:03.387593\nSource: Claude Code Hook System\nExecution Mode: Delegated (Claude is READ-ONLY)\nFocus: Error analysis and resolution"
}